{
  "title": "Mr",
  "firstName": "John",
  "lastName": "Smith",
  "dateOfBirth": "1965-12-27",
  "gender": "Male",
  "address": {
    "address1": "Flat 1",
    "address2": " Armageddon House",
    "address3": "Giggleswick",
    "address4": "Merton",
    "address5": "Greater London",
    "postcode": "L32 1AB"
  },
  "contactDetails": {
    "home": "020 7219 5206",
    "mobile": "020 7219 5207",
    "email": "email@email.com"
  }
}
